rank	title	price	publisher	category	description	download	inAppProducts	lastUpdate	size	rate
2016-06-17	453	윈드소울 for Kakao	0	Joymax Co. Ltd.	롤플레잉	내 영혼에 울려퍼지는 모험의 바람 윈드소울!#전략으로 승부하는 히어로 배틀 RPG!#액션은 거들 뿐 전략으로 승부하라! 윈드소울히어로 배틀 RPG로 태어난 윈드러너 그 또 하나의 이야기내 모험의 전성기가 지금 시작됩니다!▶ 전략이 다른 배틀의 재미를 느껴라!강 건너 모험 구경은 이제 그만!요리조리 머리를 굴리며 전투의 최전선에 서자!어떻게 전략을 짜느냐에 따라 모험의 참맛이 달라져요!▶ 손맛이 찰지구나 스킬을 날려보자!모험에서 위기에 빠졌다구요?히어로와 소환수의 다양한 스킬을 써보세요!정확한 타이밍에 꾸욱 터치해주면 스킬의 위력도 UP! UP!▶ 골라먹는 재미가 있는 윈드소울 게임모드 쓰리!머리굴리는 전략의 재미 시나리오 미션 깨고 스토리를 이어 가는 탐험 모드!따라올테면 따라와 봐! 누구보다 멀리 강하게 오래 가는 이계던전!네 히어로가 내 히어로보다 강하다고? 한 판 붙는 챔피언십!▶ 러너의 변신은 무죄! 윈드러너 전장에 서다!사악한 어둠술사 이브람에게 잡힌 클로이를 구하라!눈도 귀도 즐거운 컷 애니메이션과 함께 하는 판타지 대모험!두근두근 이야기가 전개됨에 따라 만날 수 있는 히어로도 증가!더 많은 정보를 보고싶다면!? 윈드소울 공식 카페에서 만나요!http://cafe.naver.com/windsoulweme※ 유료 콘텐츠(아이템) 구매 시 별도의 요금이 부과됩니다.● 청약 철회 및 구매 대금의 환불 등- 이용자가 구매한 유료콘텐츠의 경우에는 계약 체결일 또는 유료콘텐츠 이용가능일로부터 7일 이내에 별도의 수수료 없이 청약철회(구매취소)를 할 수 있습니다.단 선물 및 이벤트 등 회사나 제3자로부터 무상으로 제공받은 유료콘텐츠 청약철회 요청 당시 이미 사용하였거나 사용한 것으로 간주되는 유료콘텐츠 등이에 준하는 특성을 가진 일부 유료콘텐츠에 대하여는 관련 법령에 따라 청약철회(구매취소)가 제한될 수 있습니다.● 청약 철회에 따른 효과- 회사는 이용자로부터 재화 등을 반환 받은 경우 3영업일 이내에 대금을 환급합니다단 수납확인이 필요한 결제수단의 경우에는 수납확인일로부터 3영업일 이내에 이를 환급하도록 합니다.이 경우 회사가 환급을 지연한 때에는 그 지연기간에 대하여 관련 법령에서 정한 이율을 곱하여 산정한 지연이자를 지급합니다.● 미성년자 결제에 대한 조항- 애플리케이션에서 판매되는 유료콘텐츠를 미성년자가 법정대리인의 동의 없이 결제한 경우 미성년자 또는 법정대리인은 결제를 취소할 수 있습니다.단 미성년자의 유료콘텐츠 결제가 법정대리인으로부터 처분을 허락 받은 재산의 범위 내인 경우 또는미성년자가 사술 등을 사용하여 성년자로 믿게 한 때에는 취소가 제한됩니다.유료콘텐츠 구매자가 미성년자인지 여부는 결제가 진행된 단말기 또는 신용카드 등 결제수단의 명의자를 기준으로 판단됩니다.미성년자 결제취소를 요청하시는 경우 회사의 필요에 따라 미성년자 및 법정대리인을 증명할 수 있는 서류를 제출하여야 합니다.* 윈드소울은 갤럭시 S2 스펙의 기종 및 Android 2.3.6 이상에서 원활하게 플레이할 수 있습니다.[고객문의] ws_cs@joymax.comⓒ JOYMAX Co. Ltd. All Rights Reserved.----개발자 연락처 :조이맥스경기도 성남시 분당구 대왕판교로644번길 49	500 000 - 1 000 000	항목당 가격 ₩3 000 ~ ₩100 000	2016년 6월 1일	45M	4.4
2016-06-17	454	2013프로야구	0	GAMEVIL Inc.	스포츠	대한민국 대표 스마트폰 야구! 게임빌 2013프로야구지금 친구들과 함께 최고의 슈퍼클래스가 누구인지 겨뤄보세요~~★2013프로야구는 이래서 재밌다!★1. 나만의 슈퍼클래스를 키우는 재미!- 경험치를 통한 레벨업과 능력치 카드 시스템 신규 도입- 선수 정신력에 대한 멘탈 능력치 신규 도입- 세상에 단 하나뿐인 슈퍼클래스를 만들게 해주는 무한 능력치 숙련 강화 시스템 신규 도입- 보다 빠른 레벨업을 도와주는 컵대회 승격/강등 시스템 신규 도입2. 생동감 넘치게 즐기는 야구의 재미!- 자연스러운 선수 움직임과 디테일한 해상도의 FULL HD 그래픽- 리얼한 타격 투구 패턴을 구현해주는 업그레이드된 게임 엔진- 실제 육성의 리얼한 중계/해설 사운드- 타격시 타구를 쫓아가는 카메라 트래킹 VIEW3. 캐쥬얼하게 즐기는 야구의 재미!- 6명의 여자 마선수와 펼치는 흥미진진한 연애 스토리와 마선수 버프 시스템- 뛰어난 몰입감을 주는 다양한 퀘스트- 헬멧/배트/신발/장갑의 장착 아이템과 유니폼/헤어/염색/스킨의 코스튬 아이템- 남녀노소 누구나 쉽게 즐길 수 있는 간편한 조작4. 친구들과 함께 즐기는 야구의 재미!- 친구들과 함께하는 훈련 돕기 선물 기능 등 다양한 소셜 컨텐츠- 네트워크 대전(PVP) 이벤트 대전 일일과제 미션 선수거래소 등 다양한 네트워크 컨텐츠★게임 이용 전 꼭 확인해주세요★1. 상품 내 결제 기능 이용 시 잠금설정 확인 등 추가 인증이 발생할 수 있습니다.2. 게임에서 구매한 디지털 상품은 '전자상거래 등에서의 소비자 보호에 관한 법률'에따라 청약철회가 제한될 수 있으며 관련 문의는 게임빌 고객만족센터로 접수 부탁 드립니다.3. 단말기 정보[USIM 전화번호 통신사 명의자]변경 시 기존 데이터는 연동되지 않습니다.4. 데이터 백업을 하지 않고 게임 삭제 및 단말기 데이터 초기화 시 기존 데이터는 복구 불가 합니다.5. 원활한 이용을 위해 배터리 부족 방지 불법프로그램 사용금지 데이터 백업/복구를 권장합니다.※ 게임 특성에 따라 일부 내용의 차이가 있을 수 있습니다.※ 게임빌 고객만족센터 : http://care.gamevil.com/_______________뉴스&이벤트홈페이지 : http://www.gamevil.com모바일웹 : http://m.gamevil.com페이스북 : http://facebook.com/gamevilfan	5 000 000 - 10 000 000	항목당 가격 ₩1 000 ~ ₩100 000	2016년 3월 13일	53M	4.5
2016-06-17	455	소환사가 되고싶어 for Kakao	0	NTREEV SOFT	롤플레잉	★게임 소개모바일로 다시 만나는 트릭스터!깜찍발랄 소환수와 함께하는 신나는 모험!* 깜찍 발랄한 소환수와 함께!개성있고 깜찍한 도트 캐릭터와 매력넘치는 일러스트로 표현된소환수가 펼치는 신나는 모험 이야기.소환수가 되어 돌아온 다양한 트릭스터의 캐릭터를 모아 나만의 강력한 파티를 완성하자!* 보드 스테이지의 쫄깃한 재미!보드판으로 만들어진 스테이지를 이동하며 새로운 재미를 만끽.몬스터와 전투 뿐 아니라 다양한 말판의 기능을 활용하여 스테이지를 공략 할 수 있다면 당신이 이미 숙련된 소환사!* 빠르고 상쾌한 턴 배틀!턴 배틀은 지루하고 복잡하다고?터치하면 반응하는 소환수! 속도감 넘치는 전투! 화려하고 쓰기편한 스킬까지!머리로는 속성 전략을 고민하지만 손은 먼저 움직인다!* 마을 주민의 마음을 얻어라♥뽑기로만 얻어지는 무감각한 캐릭터는 이제 그만.마을 주민에게 관심과 애정을 쏟는다면 어느새 당신과 함께 모험하는소환수가 되어있다!* 새롭게 펼쳐지는 모험 이야기특색있는 스토리로 많은 사랑을 받은 온라인 트릭스터의 세계관과 이어지는새로운 모험 이야기가 [소환사가 되고싶은] 여러분을 기다린다!★ 공식 카페 http://cafe.naver.com/sosiper★ 게임 관련 문의는 게임 내 [메뉴>고객센터>1:1문의]를 통해 접수해주세요.--------------------------------[청약철회 및 환불에 대한 안내]유료로 구매한 재화는 구매일로부터 7일 이내에 게임 내 고객센터를 통해 청약철회 신청이 가능합니다.단 유료재화를 통해 구매한 아이템은 청약철회가 제한되니 자세한 사항은 서비스 이용약관을 확인하여 주시기 바랍니다.----개발자 연락처 :1661-9516경기도성남시 분당구 대왕판교로644번길 12 씨타워8층(삼평동 엔씨소프트 판교알앤디센터)	1 000 000 - 5 000 000	항목당 가격 ₩3 000 ~ ₩100 000	2016년 4월 25일	23M	4.3
2016-06-17	456	그라나사 - EP2. 가문점령전	0	Neowiz Games	카드	그라나사 : 전쟁으로 진화한 카드 RPG▣게임 소개▣여신의 가호 아래 태어났으나인간의 탐욕으로 고통 받는 운명의 대륙 그라나사.3개의 가문으로 대립되는 전쟁의 소용돌이에서 시작되는 본격 초미소녀 카드 RPG!가문 점령전까지 오픈된 완.전.체 그라나사! 지금 확인하세요!▣게임 특징▣▼하나 3개의 가문과 5명의 신성! 선택에 따라 전쟁의 운명이 갈린다!- 체스터 콘라드 베루스 가문 중 하나를 선택하고 가문전을 시작하세요!- 아름답고 강력한 신성의 버프를 받고 모험을 시작할 수 있습니다.▼둘. 카드 RPG 최초의 대규모 RVR 전쟁!- 선택한 가문에 따라 벌어지는 대규모 가문전을 경험하세요!▼셋 단언컨데 최고의 일러스트!!- 생동감과 볼륨감 넘치는 신성들의 움직이는 일러스트!- 특A급 일러스트! 두말하면 잔소리! 직접 확인하세요!▼넷 긴장감 넘치는 전투와 PVP는 기본- 3D로 펼쳐지는 전투와 PVP로 전투의 짜릿함을 느껴보세요!▼다섯 친구와 함께하는 레이드 던전- 혼자하는 카드게임은 No! 친구와 함께 우정의 레이드 한판!▣베스트 리뷰▣밀리언아서 큐라레 데빌 메이커 등 많은 TCG 게임을 즐겨봤지만최근 모바일 게임 중에서는 가장 추천 할만 하네요.미소녀 판타지 풍으로 독특한 분위기를 잘 구현 했는데약간의 공략만 알면 RPG 게임처럼 육성하는데 큰 어려움이 없어요.페이스북 로그인처럼 네이버 카카오 자동 로그인은 나중에 추가되면 좋겠어요■ 게임물관리위원회 등급분류번호 - CC-OM-141113-007■ 네오위즈 스마트폰 게임포털 ‘피망’에서 자세한 정보를 확인하세요.공식 사이트 : http://smart.pmang.com/모바일 웹 : m.pmang.com■ 언제 어디서나 스마트한 즐거움 네오위즈가 만들어갑니다.ⓒ NEOWIZ GAMES Corp. All rights reserved.----개발자 연락처 :경기도 성남시 분당구 대왕판교로 645번길 14 네오위즈판교타워 463-400사업자 등록번호: 120-87-14245통신판매업 신고번호: 제 2010-경기성남-0562호+8216008870	100 000 - 500 000	항목당 가격 ₩3 000 ~ ₩90 000	2016년 5월 31일	26M	4.2
2016-06-17	457	UNKILLED	0	MADFINGER Games	액션	UNKILLED가 수상의 영예를 안았습니다!다수의 수상 경력과 지금까지 경험한 적 없는 탁월한 그래픽을 자랑하는 모바일 슈팅 게임.온라인 멀티플레이어 방대한 스토리라인 특수 임무 다양하고 개성있는 무기들세계 좀비 발생의 중심지인 뉴욕시에 생존한 당신은 대좀비 유닛 울프팩의 멤버인 조입니다. 울프팩은 좀비와 인간 적에 대한 수색 추적 제거 작전을 펼치는 민간군사조직입니다. 이 위기가 전세계로 확산되는 것을 막을 수 있는 것은 과연 누구일까요? 자신의 멀티플레이어 캐릭터를 강력한 살상 무기로 만드세요!무차별 공격!* 뛰어난 가성비를 자랑하는 300개의 스토리 미션* 개성있는 적들과 보스들: 셰리프 다저 마인스위퍼 부쳐 등!* LSAT SAIGA-12K 산탄총 M24 저격 소총 등을 포함한 50가지가 넘는 무기!* 플레이어의 생존 확률을 높여 주는 아군 유닛!PvP 멀티플레이어* 특별 PvP 공간에서 진짜 상대와 결투를 펼치세요.* PvP 대결을 위해 특수 스킬을 보유한 영웅을 선택하세요.* PvP에서 승리하여 획득한 정보 로 영웅의 레벨을 올리고 다양한 스킬 트리를 익혀보세요.* 토너먼트에서 우승을 차지하고 실제 상품을 획득하세요.스커미시 옵스 - 비동기 PvP* DNA 설계도 를 완성해서 좀비 군단을 구축하세요.* 좀비를 복제하고 강화시키세요.* 좀비 군단으로 다른 플레이어의 기지를 공격하세요.* 다른 플레이어의 군단의 공격으로부터 자신의 기지를 방어하세요.* 리더보드에 전체 점수가 기록됩니다.* 중립 좀비 - 어려움 난이도의 일반적인 미션부드러운 1인칭 슈팅 액션!수백만 명의 플레이어들을 통해 검증된 독특한 MFG 모바일 기기 컨트롤 방식직관적인 게임 플레이: 액션에 집중할 수 있게 해주는 자동 사격 시스템다수의 게임 패드 지원예리한 관찰력을 갖고 계신가요? 새로운 아드레날린 기능으로 자신의 눈을 테스트해 보세요!황당하고 터무니없게 놀라운 그래픽!고해상도 소프트 섀도우GPU 시뮬레이션 입자 효과텍스처 처리된 반사되는 표면SpeedTree를 통한 식물 렌더링하이 폴리곤 캐릭터 모델영화적 느낌을 위한 후처리 효과NVIDIA Tegra X1 기능- 모든 특수 효과에 3배 많은 입자 (사망 출혈 폭발 탄환 충격)- 모든 입자 효과 개선- 모든 반사 개선- 더욱 세밀해진 리얼 타임 섀도우게임 특징- 플레이어 닉네임 옵션- 주간 토너먼트 헤드샷 보스 킬 등을 확인할 수 있는 UNKILLED 웹 리더보드- 새로운 도전 과제	5 000 000 - 10 000 000	항목당 가격 ₩4 999 ~ ₩99 999	2016년 5월 27일	NA	4.4
2016-06-17	458	피싱훅	0	mobirix	스포츠	친숙한 물고기부터 거칠고 힘센 놈들과의 짜릿한 승부가 손 안에서 펼쳐집니다.낚시를 몰라도! 낚시를 알아도! 너무너무 재미있는 Fishing Hook 의 세계에 푹~ 빠져보세요!실제 Fishing 하는 느낌 그대로! 극강의 손맛을 느껴보세요!- 파도를 타고 튀어 오르는 물고기와 활처럼 휘어지는 낚싯대의 떨림을 한번 느껴보시면 더 이상 Fishing 하러 멀리 가실 필요 없을 거예요~- 실제 낚시를 방불케하는 물고기와의 밀당! 물고기의 특성을 알면 알수록 더욱 깊이 빠져드는 정교한 손맛에 흠뻑 매료되실 거예요.훅! 당기면 낚는다! 쉽지만 정말 리얼한 Fishing 플레이!- 버튼만 당기면 물고기가 훅~! 게임에 익숙해지기까지 1분이면 충분합니다.- 준비 과정없이 낚싯대만 던지면 끝! Fishing 를 몰라도 당기기만 하면 여러분도 낚시왕이 될 수 있어요.전 세계 유명 휴양지로 떠나는 환상적인 낚시여행!- 바빠서 휴가를 못 즐기셨나요? 그렇다면 전 세계 휴양지에서의 선상 낚시 어떤가요! 피싱훅에서 그 황홀한 순간을 맛보세요!- 시간이 흐르면 아름답게 배경이 변하는 모습에 절로 탄성이! 밤하늘을 수놓은 오로라를 보면서 낚시하는 기분은 정말 최고겠죠!세상에.. 이런 물고기가 있었어?! 피싱훅에서 만나는 희귀 물고기 퍼레이드!- 귀하기로 천금에 버금간다는 황순어와 온 몸이 투명한 할로우 피쉬 등.. 좀처럼 볼 수 없는 희귀 물고기를 피싱훅에서 땡겨보세요!- 챌린지 물고기를 방생하면 더 힘세고 비싸게 성장해서 다시 잡히는 챌린지 찬스! 엄청난 보상과 업적이 뒤따르는 챌린지 기회를 꼭 놓치지 마세요~데이터 걱정 끝! 언제 어디서나 간편하게 즐길 수 있는 고퀄리티 낚시 게임!- 저용량이라도 화면 밖으로 물고기가 튀어 오를 것 같은 극상의 그래픽 퀼리티를 즐길 수 있어요!- 네트워크 기반이 아니므로 처음에 설치할 때를 제외하고는 언제 어디서나 데이터 소모없이 플레이 할 수 있습니다.* 다국어 완벽 지원!한국어 English 中文简体 中文繁體 日本語 Pусский язык français Deutsch Español Português Italiano Türkçe हिंदी ภาษาไทย Bahasa Indonesia Tiếng Việt 의 다양한 언어로 즐길 수 있습니다.★권한 관련★피싱훅에서 요구하는 다음과 같은 권한들은 원활한 게임 진행을 위해 적용되어 있습니다.1. 기기 사진 미디어 파일 액세스 - 낚시 결과를 공유하기 위한 스크린샷 이미지 전송을 위한 목적2. 주소록 - 데이터 저장 및 유저 데이터 연동을 위한 목적3. 전화 걸기 및 관리 - 전화 수신 시에도 정상적인 게임 진행을 위한 목적Android 6.0 이상 OS에서는 피싱훅의 각 권한이 자동으로 허용되지 않기 때문에게임 이용에 다소 제한이 발생할 수 있습니다.Android 6.0 이상 OS를 사용 중이신 분들께서는 아래의 방법으로 진행해 주시면 원활한 게임 이용이 가능합니다.1. 최초 실행 시 해당 권한 사용 여부를 묻는 팝업 출력 시 각각의 권한 허용2. 휴대 전화의 환경 설정 메뉴에서 어플리케이션 관리 > 피싱훅 > 권한 > 각각의 권한들을 허용으로 적용다소 번거로우시더라도 위의 방법대로 진행을 부탁 드립니다.★주의사항★1. 휴대전화 단말기 교체 시 또는해당 애플리케이션의 삭제 시 데이터가 초기화됩니다.2. 해당 상품에는 부분 유료 아이템 및게임 머니 결제기능이 포함되어 있습니다.부분 유료 아이템 및 게임 머니를 결제할 시실제 과금이 발생하오니 이점 유의하시기 바랍니다.3. 게임에서 구매한 디지털 상품은'전자상거래 등에서의 소비자 보호에 관한 법률'에따라 청약철회가 가능하거나 제한될 수 있습니다.Homepage:https://play.google.com/store/apps/dev?id=4864673505117639552Facebook:https://www.facebook.com/mobirixplayen----개발자 연락처 :02-2025-7804서울특별시 구로구 디지털로33길 11 에이스테크노타워 8차 606호주식회사 모비릭스사업자등록번호:130-86-28545통신판매업번호:제 2011-서울구로-0792호통신판매업기관:구로구청	10 000 000 - 50 000 000	항목당 가격 ₩2 000 ~ ₩100 000	2016년 6월 15일	36M	4.4
2016-06-17	459	히어로 스쿼드	0	Nsouls	롤플레잉	던전을 클리어하고 스킬들을 활용하며 거대한 보스 몬스터들을 물리치자!쉬운 조작과 시원한 타격감을 가진 중독성 높은 탭 RPG 아케이드 게임 히어로 스쿼드!★ 인기 신규무료게임 TOP 12위 달성 ★★ 한국에서 출시 4일만에 핫이슈 1위 달성 ★★ 요즘 완전 핫한 게임 ★용사는 쉴 틈이 없다! 잠시 한 눈 판 사이 또 다시 마왕에게 잡혀간 우리의 공주!지겹지만 오늘도 공주를 구하기 위해 모험을 떠나야만 하는 세 명의 용사들!❖ 10가지가 넘는 테마를 여행하며 190마리의 각각 다른 몬스터!❖ 스테이지들을 별 5개로 클리어 하여 강력한 다음 무기들을 언락!❖ 화려한 스킬을 자유자재로 사용하여 스테이지를 최단시간내에 클리어!❖ 귀여운 캐릭터들과 화려한 픽셀 아트!■■■게임의 특징■■■• 최대한 빠르게 탭하여 스테이지들을 별 5개로 클리어 하세요!• 강력한 위력을 가진 스킬들을 사용하여 몬스터들을 물리치세요!• 10개의 던전 100개가 넘는 스테이지를 모두 클리어 하세요!• 어마어마하게 강력한 보스 몬스터들을 물리치세요!• 점점 강력해지는 수십가지의 무기들을 전부 모으세요!• 독특한 개성과 특별한 스킬들을 가진 15가지의 영웅들로 히어로 스쿼드를 완성하세요!• 보너스 던전과 잭팟을 통해 엄청난 양의 골드를 얻으세요!• 엄청난 효과를 가진 30개의 보물을 모아 도감을 완성하세요!• 영웅들을 환생시켜 더욱더 강해지세요!• 반전이 있는 재미있는 스토리를 즐기세요!• 흔한 탭 노가다 게임들과는 다르다 지금 바로 플레이 하세요!히어로 스쿼드는 레트로 게임 탭 게임 RPG 게임 아케이드 게임을 좋아하는 이들 누구나 재밌게 플레이 할 수 있는 중독성 높은 게임입니다. 우리 모두 공주를 구하러 갑시다!※ 본 게임은 삭제시 지금까지 진행했던 모든 데이터가 사라질 수 있습니다. 어플리케이션을 지우지 말아주세요 구글 클라우드 세이브 기능을 추후 구현할 예정입니다.▶ 네이버 공식카페 : http://cafe.naver.com/herosquad▷ 히어로 스쿼드 페이스북 : https://www.facebook.com/HeroSquadMobileGame히어로 스쿼드의 가장 최신 정보를 만나 볼 수 있는 공식 페이스북을 방문해보세요!▷ 엔소울즈 트위터 : https://twitter.com/NsoulsGames----개발자 연락처 :Phone: (+82)70-8635-0132Email: support@nsouls.com13 Dosan-daero 8-gil Gangnam-gu Seoul 06039 South Korea	10 000 - 50 000	항목당 가격 ₩1 000 ~ ₩10 000	2016년 6월 7일	38M	4.6
2016-06-17	460	HEAVENSTRIKE RIVALS - TCG PVP!	0	SQUARE ENIX Co. Ltd.	전략	Enter a war-torn world on the brink of extinction embark on an epic adventure and fight your way to the top of the PvP leaderboards in HEAVENSTRIKE RIVALS the latest tactical RPG from SQUARE ENIX.Enjoy a battle system designed especially for mobile devices that's easy to learn but with deep strategic possibilities quick-entry player-vs-player combat and hundreds of unique characters to collect grow and evolve.Challenge the world and ascend the rankings until you rule over all!*** FEATURES ***- Battle against players across the world in simple yet deep tactical battles built especially for mobile devices- Collect and train over 700 fully-animated units- Embark on an epic quest across Lunnain to save the legendary Seven Sisters- Climb the Sacred League to earn epic rewards- Take part in regular events and weekend Arena competitions- Features characters designed by Ryoma Ito (FINAL FANTASY TACTICS ADVANCE) and music by Ryo Yamazaki (FINAL FANTASY CRYSTAL CHRONICLES THE CRYSTAL BEARERS)The once-prosperous aerial kingdom of Lunnain lies in tatters assaulted from above by the Fallen - ruthless monsters of nightmare who seek only complete destruction. But the people will not take their fate lying down and their strike back at the heavens starts now!****************** TOP GROSSING SALES ***All- Top 10 : 3 countries- Top 100 : 27 countriesStrategy Game Category- Top 10 : 4 countries- Top 100 : 96 countries멸종의 위기에 전쟁으로 파괴 된 세계를 입력 서사시 모험에 착수하고 HEAVENSTRIKE 라이벌 SQUARE ENIX의 최신 전술 RPG의 플레이어 간 전투 리더의 상단에 당신의 방법을 싸웠습니다.쉽게 배울 수 있지만 수집 성장하고 발전하는 깊은 전략 가능성 빠른 항목 플레이어 대 플레이어 전투 독특한 캐릭터의 수백의 특히 모바일 기기를 위해 설계된 전투 시스템을 즐길 수 있습니다.세계에 도전하고 모두 다 스릴 때까지 순위를 상승!*** *** 특징- 특히 모바일 장치에 내장 된 단순하지만 깊은 전술 전투에서 전 세계 플레이어에 대한 전투- 수집 및 700 완전히 애니메이션 단위 이상 교육- 전설 일곱 자매를 저장 Lunnain에서 서사시 탐구에 착수- 서사시 보상을 적립 신성한 리그 등반- 정기적 인 이벤트와 주말 아레나 대회에 참여- 료 야마자키에 의해 료마 이토 (FINAL FANTASY 전술의 ADVANCE)와 음악에 의해 설계 문자 기능 (FINAL FANTASY 크리스탈은 크리스탈 베어러 연대기)만 완전한 파괴를 추구 악몽의 무자비한 괴물 - Lunnain의 한때 번영 공중 나라는 타락에 의해 위에서 폭행 누더기에 자리 잡고 있습니다. 그러나 사람들은 누워 자신의 운명을하지 않으며 하늘에서 다시 자신의 파업은 이제 시작!****************** TOP의 수익을 올리는 판매 ***모든- 10 : 3 국가- 상위 100 : 27 개국전략 게임 카테고리- 10 : 4 개국- 상위 100 : 96 개국	500 000 - 1 000 000	항목당 가격 ₩4 622 ~ ₩90 592	2016년 5월 19일	NA	4.2
