rank	title	price	publisher	category	description	download	inAppProducts	lastUpdate	size	rate
2016-06-17	305	리그 오브 병스터 for AfreecaTV	0	BSGames	캐주얼 게임	★너무 웃겨서 방귀가 나오는 게임 ★**설치 후 추가 다운로드를 하지 않습니다.**★★ 새롭게 탄생한 [초콜릿 몰빵전] ★★모든 유저들의 초콜릿을 한데 모아 잘하는 클랜과 트레이너(유저)들에게 몰아주는 신개념 몰빵전!!이제 여러분들도 초콜릿 몰빵의 주인공이 될 수 있습니다!!★★ 리그에 도전하라!!! ★★************************************************수조억마리의 외계인들이 지구로 몰려왔다!!외계인들은 지구에서 폭발적인 배변활동을 하기 시작했다!!지구가 썩고있다!! 지구는 배설물로 멸망 위기에 놓여있다!!“병스터 사령부”는 외계인들을 처치하기 위해 리그를 개최하였다.리그의 최강자가 되기 위하여! 지구를 구하기 위하여!전 세계의 트레이너들은 리그에 도전하라!!!!!!!!*************************************************★★★ 게임 정보 ★★★■ 수백여 마리의 병스터를 키워보세요!게임의 꽃이라 할 수 있는 수백여 마리의 병스터들을 사육해 보세요. 깨물어주고 싶을 정도로 깜찍하고 더럽게 못생긴 병스터들은 언제나 당신의 편입니다. 게임 속에서 귀엽고 앙증맞고 매우 이상하게 생긴 다양한 병스터들을 만나보세요! 못생겼다고 버리면 안돼요!애완동물 펫 미니펫과 같은 병스터! 사랑으로 길들여 주세요.■ 최첨단 FPS 게임! 고퀄리티 저격 스나이퍼 게임!FPS게임을 하면서 타격감에 아쉬움을 느끼셨나요? 총기 수류탄 등 다양한 무기들을 사용하여 외계인들을 물리쳐 주세요. 외계인들의 다양한 부위를 맞출 때마다 신선한 타격감을 느낄 수 있을 것입니다!밀크샷 에그샷 백샷은 여러분들에게 찰진 타격감을 선사합니다.■ 다른 사용자 친구들하는 대전 게임! 랭크 게임!다른 사용자들과 대결을 하고 싶으신가요? 페이스 북 아이디로 로그인을 하시면 다른 사용자들과 랭크 게임을 즐기실 수 있습니다.■ 대서사 스토리의 미션과 스테이지친절한 튜토리얼 강사가 여러분들이 게임을 쉽게 즐기실 수 있도록 가르쳐 줄 것입니다. 개성 넘치는 수많은 병스터 트레이너들이 당신의 도전을 기다리고 있습니다. 다양한 맵에서 펼쳐지는 미션과 스테이지를 모두 클리어 해보세요!*** 2018.0 버전 업데이트 안내 ***컨텐츠 업데이트1. 신규 병기 4종 추가2. 9성급 병스터 추가 및 다른 등급 병스터 추가3. 반지 3종 추가4. 팔지 3종 추가5. 동물 2종 추가6. 새 3종 추가7. 유니폼 6종 추가8. 스테이지 90개 추가9. 병스터 진화 4단계 추가10. 음료수 14종 추가시스템 업데이트1. 주간 보상 추가(병스터 고급 뽑기)2. 신의 탑 시즌2 시작밸런스 조정1. 병스터 능력치 힘 집중 향상2. 모든 스테이지 레벨 디자인 수정기타1. 페이스북 로그인 버그 해결2. 성능 및 용량 최적화3. AfreecaTV 로그인 버그 해결★★★ 커뮤니티 ★★★공식카페 : http://cafe.naver.com/byungster페이스북 : https://www.facebook.com/byungster트위터 : https://twitter.com/byungstercorpor----개발자 연락처 :3-106ho Hanil Apt 44 Geomdan-ro 501beon-gil Seo-gu Incheon+820156360115support@byungster.zendesk.com	100 000 - 500 000	항목당 가격 ₩2 000 ~ ₩90 000	2016년 5월 23일	49M	4.3
2016-06-17	306	클럽포커 온라인 -바둑이 7포커 하이로우	0	Fungrep Co Ltd	카지노	쪼는 맛이 있는 스마트폰 온라인 정통 포커 클럽 포커 온라인 온라인 정통 포커(Classic Poker) 느낌 제대로 살렸어요.바둑이 게임을 추가했고 리뉴얼된 디자인으로 한층 향상되었어요.게임내 상점이 추가되어 원활한 게임플레이를 할 수 있어요.J탑도 좋아요~~ 역전의 묘미 ♣ 바둑이 ♣: 베팅의 묘미! 로우 바둑이 게임을 새롭게 추가했어요.: 자동커팅으로 빠르게 경기를 진행할수 있어요10탑도 좋아요~~ 눈치코치 ♥ 하이로우 ♥: 눈치 고수들의 선택! 하이로우를 즐겨보세요: 로우 하이 선택 잘하면 승리는 나의것.2페어도 좋아요~~ 뻥카 진카 모두 모여! 정통 온라인 세븐 포카: 진정 포커 고수의 선택! 7 포커: 포커 고수들과 한게임 해보세요.*** 잼나요 고고싱 by 010****5552*** 한게임 한게임 시간 때우기 짱인데... by 010****7796*** 중독성이 강해요 넘재밌잖아~ by car******초보 중수 고수 모두가 즐기는 클럽 포커 온라인!지금 무료 다운로드 받으세요.[지원게임]* 로우 바둑이 7 포커 하이로우 (Badugi 7 Poker Highlow)[게임물 등급분류번호]* 2016-5-26 (제 CC-OM-160526-002 호)★ 고객지원 ★- 이메일 : help@fungrep.com- 온라인 : http://www.tk.co.kr/support----개발자 연락처 :Tel.+82-70-8798-9658 Fax. +82-6209-81988 Yanghwa-ro 11-gil (Seokyu-dong Handong Building) Mapo-gu Seoul Korea	50 000 - 100 000	항목당 가격 ₩3 000 ~ ₩90 000	2016년 6월 15일	27M	4.7
2016-06-17	307	엔젤스톤 with NAVER	0	Fincon	롤플레잉	※ 안드로이드 OS 버전 6.0 이상에서는 게스트 계정을 이용하실 수 없습니다.-----------------최상의 그래픽과 최강의 재미? 그건 이젠 기본이다.손가락 액션으로 터지는 통쾌한 기술들 동시에 다른 유저들과 즐기는 거대 몬스터 사냥과 분쟁지역!스테이지의 진행방향과 보상을 내가 결정한다.내 장비에 붙는 옵션을 내가 바꿀 수 있다고?엔젤스톤이 같은 직업이라도 전혀 다른 플레이를 만든다.▶ 게임의 특징 ◀■ 이제 액션으로 스킬을 시전하자.RPG라서 조작이 어렵다구요?터치에 스킬을 찾아 누를 필요도 없다.클릭하고 손가락 움직임 한번으로 스킬이 발동한다.이것 저것 찾아서 클릭할 필요 없이액션 한번에 통쾌한 스킬을 시전해보자■ 이제 실시간 파티 플레이다!이제 이름만 같은 친구 아이디로 들어온로봇같은 파티원들과의 플레이는 끝났다.실시간으로 리얼 친구들과 같이 즐기자> 혼자 사냥하기 힘들던 강력한보스몬스터(보스레이드) 사냥> 바보같이 움직이던 무늬만 친구들이던가짜 친구들 이젠 안녕~!> 역시 뭐니 뭐니 해도 사람들과의 경쟁이 제일 꿀잼.일정한 패턴이 없는 리얼 친구들과의 전투는짜릿함 마저 선사한다.> 한타의 맛? 이제 엔젤스톤에서~!친구들과의 호흡이 제대로 먹혔을 때의 짜릿함을이제 내 폰에서~■ 시원시원하게 펼쳐지는 스테이지스테이지 공략을 내가 결정해서 진행한다.시원시원하게 진행되는 스테이지 공략~원하는 아이템까지 드랍된다면 금상첨화~!■ 만렙 이후 펼쳐지는 또 다른 세계스테이지 공략 후 할게 없다면?만렙이후 시작되는 진정한 엔젤스톤의 재미만렙은 시작에 불과하다~!진정한 재미는 만렙이후 펼쳐질플레이간 경쟁과 레이드의 재미에 쏙 빠져보시라.■ 길드를 만들어 같이 하는 재미를 더하라길드를 통해 협력하고 경쟁하라.길드 안에서만의 경쟁은 의미 없다.그 동안 찍어낸 듯한 RPG에 질리셨다면 진정한 RPG의 명가 FINCON이 만들어낸 리얼 RPG를 느껴보세요.당신의 스트레스를 지옥으로 돌려보낼악마 같은 매력의 RPG!FINCON이 제시하는 고퀄리티 리얼 RPG~!엔젤스톤과 함께하세요!* FINCON은 항상 최고의 게임과 서비스를제공하기 위해 유저 여러분의 의견에 집중합니다.Languages Supported:* English* Deutsch* Français* Español (Europa)* Italiano* 한국어 (Korean)* 日本語 (Japanese)* 简体中文 (Simplified Chinese)* 繁體中文 (Traditional Chinese)* Bahasa Indonesia* Português (Brasil)* ภาษาไทย (Thai)엔젤스톤 YouTube 채널 : https://www.youtube.com/user/fincongames엔젤스톤 공식포럼 : http://forum.angelstonegame.com/핀콘 고객센터 : http://support.angelstonegame.com/----개발자 연락처 :031-706-4999경기도 성남시분당구 정자동킨스타워 602호463-782(주)핀콘	1 000 000 - 5 000 000	항목당 가격 ₩1 000 ~ ₩100 000	2016년 5월 25일	37M	3.9
2016-06-17	308	Jurassic World™: The Game	0	Ludia Inc.	시뮬레이션	큰 인기를 얻은 Jurassic Park™ Builder의 제작자들과 함께  이슬라 누블라 섬으로 돌아가 Jurassic World™: 더 게임으로 새로운 모험을 하십시오. 이 게임은 올해 여름 개봉될 기념비적인 액션 어드벤처를 기반으로 만들어진 공식 모바일 게임입니다. 새 영화에 나오는 100종 이상의 거대한 공룡들을 되살리고 상대에게 도전해 지축이 뒤흔들리는 전투를 벌이십시오. 누구도 따라올 수 없는 건설 및 공룡 전투 게임에서 미래의 테마파크를 건설하고 선사 시대를 재구성하십시오.승승장구하는 전투 팀을 만들려면 가장 효율적인 공원을 만들어 그 안에서 공룡들이 번성하고 진화하게 해야 합니다. 놀라움이 가득한 카드 팩을 획득해서 새로운 종의 공룡을 발견하십시오. 영화에 등장하는 오웬 클레어 및 여러 캐릭터들과 함께 매일매일 공룡들에게 먹이를 주고 유전적으로 개선해 주십시오. 이제 공원이 문을 열었습니다. 자신만의 Jurassic World™를 지을 시간입니다!Jurassic World™: 더 게임에서는 다음과 같은 일을 할 수 있습니다.- 과학의 법칙을 거슬러 서로 다른 공룡 100마리 이상을 얻어서 부화시키고 진화시키십시오!- 영화에서 영감을 얻은 상징적인 건물과 울창한 경치를 건설하고 업그레이드하십시오.- 전 세계의 다른 플레이어에게 도전하여 지축을 뒤흔들 전투를 치르십시오!- 영화에 등장하는 캐릭터들과 새롭고 신나는 이야기를 진행하며 긴장감 넘치는 임무를 수행하십시오!- Hasbro® Brawlasaurs 장난감으로 더 폭넓게 즐기십시오. 각각의 장난감 공룡을 스캔해서 게임 내에 데려와 전투를 시킬 수 있습니다!- 여러 카드 팩에는 각각 특별한 공룡 한 마리가 들어있습니다!- 매일 보상으로 코인 DNA 및 기타 필수 자원들을 받으십시오.이 응용 프로그램을 설치하면 라이선스 사용 약관에 동의한 것으로 간주합니다.Facebook에서 '좋아요'를 눌러서 선물 및 최신 소식과 업데이트를 받으십시오! (facebook.com/jurassicworldthegame)주의: Jurassic World™: 더 게임은 완전한 무료 플레이 게임입니다. 하지만 일부 게임 아이템은 실제 화폐로 구입해야 합니다.Jurassic World™는 Universal Studios 및 Amblin Entertainment Inc.가 소유한 상표이며 저작권입니다. Universal Studios Licensing LLC에 의해 사용이 허가되었습니다. 모든 권리 보유.	10 000 000 - 50 000 000	항목당 가격 ₩1 191 ~ ₩120 871	2016년 5월 11일	15M	4.1
2016-06-17	309	무한돌파삼국지 for Kakao	0	PATI Games Corp.	롤플레잉	◆ 무한돌파삼국지 for Kakao 시즌2- 손 끝에서 시작되는 광활한 이야기의 두 번째 막이 올랐다!- 차원을 넘어선 강함을 마주하는 순간 운명의 혈전이 시작된다!◇ 25레벨까지 거침없이 돌파하라! 신규 유저만을 위한 혜택!- 3 / 5 / 10 / 20 달성 시마다 더 많은 레어영웅뽑기권 레어장비뽑기권과 금화 증정!- 25레벨 달성 시! 7성영웅선택권 6성전설장비선택권 활동력 총 6000% 초월권 세트 한계돌파권 즉시 지급◇ 망설이지 말고 돌아오라! 복귀 유저만을 위한 특별 패키지!- 7성영웅선택권 6성전설장비선택권 국가레벨에 비례한 금화와 여의주 한계돌파권 즉시 지급!◇ 총 10챕터 100여개의 광활한 스테이지!번성까지 쉴틈없이 전진하여 방덕을 격파하라!챕터마다 거대한 역사 속 영웅들을 공략에 도전!◇ 최강 영웅 조합으로 도전하는 무한돌파 모드!밀려드는 적들의 거점을 파괴하고 끝없이 전진하라!더 이상 망설일 틈은 없다! 성벽을 파괴하고 보스를 마주하는 그 순간까지 무한돌파!◇ 어제의 동료는 오늘의 적! 9:9 팀대전 (PvP)단순한 강함은 잊어라!치밀한 전략과 영웅의 활용에서 비롯되는 신의 한 수군주의 지략만이 승리를 결정할 수 있다!◇ 최강 길드의 자리를 놓고 벌이는 치열한 길드 전투!최강의 명예를 두고 펼쳐지는 숨막히는 2시간의 혈투길드원의 단합과 효율적인 길드스킬의 활용으로 상대를 제압하라!명예의 전당에 빛나는 이름을 남겨라 최강 길드 선발전!◇ 보스와 나의 힘겨루기 토벌전주어진 시간은 3분! 컨트롤의 극한을 느끼며 끝까지 살아남아라!당신의 명성을 드높일 수 있는 최고의 즐거움!◇ 사천왕에 도전하라 길드 던전길드원과 함께 도전하는 레이드 시스템단합이 없이는 결코 극복할 수 없는 시련!시련을 넘어서는 순간 빛나는 보상을 함께 확인하라!■■ 무한돌파삼국지 공식커뮤니티 ■■- http://cafe.naver.com/mudolsamgook/----개발자 연락처 :(주)파티게임즈135-877 서울특별시 강남구 테헤란로 79길 6 JS타워 3층1661-4390	500 000 - 1 000 000	항목당 가격 ₩2 000 ~ ₩120 000	2016년 5월 2일	87M	4.3
2016-06-17	310	Piano Tiles 2	0	Clean Master Games	아케이드	전 세계를 풍미한 Piano Tiles 2(Don't tap the white tile 2)는 출시 후의 가장 큰 업데이트를 맞이했습니다!대중가요와 다양한 악기 반주를 추가하여 더욱 재미있는 음악과 더욱 풍부한 연주체험을 제공해 드립니다.특징：• 피아노 연주와 각종 악기의 반주를 동시에 즐길 수 있습니다• 대중가요를 추가하여 고전음악과 함께 감동을 줍니다• 스토리가 간단하며 시각 효과가 뛰어납니다• 친구와 대결하고 전 세계의 플레이어와 함께 연주할 수 있습니다• Facebook 계정으로 로그인하면 설비 간에 데이터를 공유할 수 있습니다• 음악 품질의 새로운 업데이트 빨리 느껴보세요플레이 큐칙:단지 음악에 맞춰 흰색이 아닌 검은 건판을 클릭하면 됩니다.뭘 망설이나요?피아노와 밴드 합주가 있는 잔치를 열어 친구와 겨루며 손 속도가 보통사람을 초월하여 더욱 빨라 지세요!지원:게임에 관련하여 질문이 있나요?pianotiles2cmcm@gmail.com에 이메일을 주시거나「설정」>「문의와 서포트」를 통해 저희와 연락할 수 있습니다.비즈니스 협력:치타 모바일에서 현재 상호 간의 성공을 위해 전 세계의 멋진 모바일 게임 개발사를 초대합니다! 훌륭한 게임을 기대하고 있겠습니다! 문의: publishing_cmplay@cmcm.com개인정보보호 정책:http://www.cmcm.com/protocol/site/privacy.html	100 000 000 - 500 000 000	항목당 가격 ₩999 ~ ₩72 152	2016년 6월 15일	기기에 따라 다릅니다.	4.7
2016-06-17	311	히어로스 차지 HD (히차・Heroes Charge)	0	uCool	롤플레잉	친구와 함께 최고의 최신 액션 RPG 멀티플레이어 온라인 전투 경기장인 HEROES CHARGE를 즐겨보세요! 긴장감 넘치고 중독적이며 빠른 속도의 게임에서 영웅을 수집하고 훈련하고 동료를 모으고 영웅을 강화하고 적을 물리치세요. 100개가 넘는 퀘스트를 통해 자신만의 스토리에 빠져보세요. 어떤 영웅을 선택하시겠습니까?= 넘치는 콘텐츠로 중독적인 게임 =- 근접전의 덩치 민첩한 궁수와 강력한 마법사 등 50개 이상의 독특하고 다양한 영웅을 만나보세요.- 크론의 세계에서 전투와 탐험을 하세요. 희귀 영웅을 찾아서 어떻게 하면 동료가 될 수 있을지도 고민해보세요!- 영웅에게 적들을 능가하는 힘을 선사해줄 장비 세트를 수집해서 스킬을 개발하고 업그레이드하세요!- 친구와 함께 또는 혼자서 수많은 전투를 치르며 즐기는 몰입도 높은 경험- 엘리트 상금을 위해 길드와 전투하며 돈독해지는 친구들과의 우정- 크론의 세계를 정복하기 위한 팀플레이 및 전략 개발- 길드를 만들거나 친구의 길드에 가입- 명예를 얻을 수 있는 PVP 경기장 전투!- 희귀 영웅 수집 및 개발!- 특별 이벤트에서 경험할 수 있는 엄청난 수의 적과의 전투!주의: Heroes Charge는 무료 게임입니다. 하지만 일부 게임 아이템은 실제 돈으로 구매할 수 있습니다. 이 기능을 사용하고 싶지 않은 경우 기기의 설정에서 앱 내 구매를 비활성화하십시오. 또한 서비스 약관 및 개인정보 보호정책에 따라 13세 이상만 Heroes Charge를 플레이하거나 다운로드할 수 있습니다.	1 000 000 - 5 000 000	항목당 가격 ₩1 200 ~ ₩120 000	2016년 4월 10일	30M	4.3
2016-06-17	312	모두의쿠키: 사천성이 달라졌어요 for Kakao	0	Netmarble Games	퍼즐	■ 남녀노소 누구나 즐길 수 있는 짝맞추기 퍼즐400 만이 즐긴 '넷마블 사천성'온 국민을 들었다 놨다 한 '모두의마블'2015년 진화한 사천성으로 새로운 기록을 써나갑니다.■ 천천히 느긋하게짝만 맞추던 사천성에서 벗어나손이 느린 사람도 재미있게 즐길 수 있는 게임을 만들었습니다.한 수 한 수 고민하며 풀어나가는 퍼즐의 재미를 느껴보세요.■ 쉽고 빠른 순도 100% 진짜 사천성! 쿠키타워!온 가족 모두 즐기는 추억의 원조 사천성언니~지금 어디서 반층임?! 한층 더 올라 봐~!■ 빠르게! 짜릿하게!빠르게 연결해 나가는 사천성 고유의 재미에 대결의 재미까지!60초 동안 피버 콤보 공격을 이용하여 가장 많은 캐릭터를 쓰러뜨리고최고 기록에 도전해 보세요.■ 귀여운 캐릭터와 함께 하는 모험개성만점 캐릭터들이 특별한 능력으로 게임을 도와줍니다.120여종의 캐릭터들을 모으고 키워보세요.성장 교배 콜렉션. 상상하는 모든 동물들이 여기에!---------------------------------------------------------------※ 유료 아이템 구매 시 별도의 요금이 부과됩니다.■ 상품 정보 및 이용 조건 안내 ■- 공급자 : 넷마블게임즈㈜ 대표이사 권영식- 이용조건 및 기간: 게임 내 별도 고지된 내용에 따름(사용기간이 표시되지 않은 경우 서비스의 종료일까지를 사용기간으로 간주)- 결제금액 및 방법 : 상품 별 별도 고지된 결제금액 및 결제방법에 따름(외화 결제 시 환율 및 수수료 등으로 인해 실제 청구금액과 다를 수 있음)- 상품지급방식 : 게임 내 구매한 아이디(캐릭터)로 즉시 지급- 넷마블 고객센터 : 1588-3995 (평일 오전9시~오후6시 상담가능)- 최소사양 : CPU 듀얼코어 1.2GHz Ram 1GB----개발자 연락처 :02-1588-3995서울특별시 구로구 디지털로 300사업자 번호 : 105-87-64746통신판매업 번호 : 제 2014-서울구로-1028 호	1 000 000 - 5 000 000	항목당 가격 ₩1 000 ~ ₩100 000	2016년 5월 20일	23M	4.4
2016-06-17	313	팜프렌지:돌아온친구들 for Kakao	0	Avocado Entertainment	캐주얼 게임	전 세계 2억명을 매료시킨 명성 그대로! 팜프렌지 친구들이 다시 돌아왔어요~랭킹을 결정 짓는 1초 차이의 쾌감! 심장 쫄깃한 타이쿤의 재미를 온몸으로 느껴보세요!◈열려라~ 팜프렌지 농장!◈◇전세계 2억명이 즐기는 팜타이쿤 레전드! 팜프렌지 농장이 다시 문을 열었어요!◇생생한 그래픽과 사운드는 넘나 좋은 것~ 개성 강한 동물들과 팜프렌지 농장을 경영해보세요~◈스테이지 is 뭔들◈◇팜프렌지에는 사계절이 있어요! 계절 타는 동물들을 직접 만나 보세요!◇다채로운 스테이지 미션을 클리어 하고 업그레이드 된 다양한 건물들을 이용해 보세요!◇빠른 스피드로 3개의 별을 획득하면 불곰의 철벽방어도 문제 없어요!◈손보다 빠른 부스터 샤샤샤~◈◇조합하랴 업그레이드하랴 손이 열개라도 모자랄 지경! 매력만점 부스터를 다양하게 사용해 보세요!◇농장에 정신적 지주! 부지런한 고양이와 씩씩한 강아지의 대활약!을 기대하세요~◈지금 필요한건 뭐? 전략적 스피드~ ◈◇시설물을 업그레이드 할수록 생산속도가 쑥쑥! 시간 단축을 위한 최적의 생산 루트를 확보하세요!◇천방지축 오소리와 얄미운 불곰의 방해를 막으려면 광클로 우리에 가둬주세요!◇창고 개방! 트럭을 이용해 돈을 벌고 헬기를 이용해 필요한 물품을 주문해보세요!◈친구들은 다 모였는데 당신만 안왔세호?◈◇불참러가 없는 팜프렌지 농장에서 친구들에게 하트도 보내고 열쇠도 요청해보세요!◇쫄깃한 랭킹 경쟁과 푸짐한 보상이 가득한 리그전에서 새로운 재미를 느껴보세요~◇팜프렌지 한정판!스티커를 모으면 스티커 포인트가 팍팍!※ 게임 문의 ※ - 아래의 경로로 문의 주시면 신속한 도움을 드리겠습니다.[게임 내 설정 -> 고객센터 -> 문의하기 버튼 클릭]- 문의 메일을 보내주실 때 반드시 카카오 회원 번호를 기재해주세요!- 게임 진행에 문제가 생기시면 단말기명/사용하는OS/버그 내용 등을 자세하게 기재하여 문의 주시면 좀 더 빠른 처리가 가능합니다.※ 안내사항 ※- 본 게임은 부분유료화 게임으로 게임 내 아이템을 구입을 할 경우 유료 과금이 발생될 수 있습니다.- 게임 플레이 중 강제종료가 되면 데이터 오류가 발생될 수 있으니 정상적으로 게임 종료를 해주시기 바랍니다.★ 팜프렌지:돌아온친구들 공식 페이스북 ★https://www.facebook.com/FarmFrenzyFriends----개발자 연락처 :Cana Building 2nd Floor 6-5 Baekjegobun-ro 39-gil Songpa-gu 138-844 Korea	100 000 - 500 000	항목당 가격 ₩1 000 ~ ₩100 000	2016년 6월 14일	49M	4.5
2016-06-17	314	진삼국대전 for kakao	0	(주)쿤룬코리아	롤플레잉	삼국시대 격전의 순간을 오감으로 느껴라!사상초유의신감각 전략시뮬레이션! 진삼국대전 for kakao 구글플레이 오픈!==============================[전장에 돌입하면 한편의 영화가 시작된다! 시네마틱 리얼 전투!]기존전략시뮬과 차별화되는 하이퀄리티 그래픽!마을이동시에는 RPG 느낌의 1인칭 시점으로 전장에서는 박진감 넘치는 전투를 실감나게 만끽할 수 있는 쿼터뷰 자유 시점으로 진정한 리얼 전투를 확인 할 수 있습니다.[한국의 위인을 삼국시대로 소환하라!]삼국시대를 무대로 하여 유명 중국무장 뿐 아니라 한국의 위인들도 전장에 출전시킬 수 있습니다.황진이/이순신/계백/김유신과 함께 난세를 평정하세요![눈과 귀를 동시에 즐겁게 하는 화려한 카드일러스트와 한국어 음성 지원!]국내성우 100% 풀 더빙작업을 통해 영웅들의 목소리를 확인 할 수 있습니다.하이퀄리티 일러스트로 재현된 영웅이 전장에 출전하여 스킬발동 시 음성 또한 같이 나와 게임을 더욱 실감나게 만들어 줍니다.[강한 영웅만으로 이기는 시대는 끝났다! 영웅육성게임에 전략을 융합하다!]각 영웅마다 병사 상성/소속국/스킬이 존재하며 이 요소를 어떻게 이용하느냐에 따라 게임의 승패가 나뉩니다.영웅의 인연을 맞춰 군대의 효율을 높일 수 있으며 여신 카드는 전투의 흐름을 유리하게 합니다.[삼국지의 주인공이 되어 역사 속 영웅호걸을 호령하라!]당신의 활약을 중심으로 게임 속 이야기가 진행되어 역사를 바꾸는 즐거움을 드립니다. 기존 삼국지 스토리에서 더욱 진화한 삼국판타지를 즐겨보세요!▶진삼국대전 공식카페http://cafe.naver.com/jinsamkakao공식적인 이벤트 진행 및 안내는 공식 카페를 통해 확인하실 수 있습니다.▶진삼국대전 CS메일kjs@koramgame.com▶개발자연락처 : 서울특별시 강남구 테헤란로20길 9 동궁빌딩 4층▶고객센터: 1566-0057	100 000 - 500 000	항목당 가격 ₩2 600 ~ ₩130 000	2016년 5월 9일	178M	4.5
